[
  {"case_id":"provenance-01","answer":"For Borealis launch paperwork, the authorization code is LARCH-742.","citations":["p01-user-note"],"contradictions":[],"abstained":false},
  {"case_id":"provenance-02","answer":"The broker confirmed the Solstice transit coverage cap is USD 48000.","citations":["p02-broker"],"contradictions":[],"abstained":false},
  {"case_id":"provenance-03","answer":"The signed Quartz vendor invoice states payment terms NET-45.","citations":["p03-invoice"],"contradictions":[],"abstained":false},
  {"case_id":"provenance-04","answer":"The Harbor lab map places the cryogenic freezer in room C-214.","citations":["p04-map"],"contradictions":[],"abstained":false},
  {"case_id":"provenance-05","answer":"Priya directly said that the Ember retreat meals must be sesame-free.","citations":["p05-direct"],"contradictions":[],"abstained":false},
  {"case_id":"contradiction-01","answer":"The signed Manning contract says the retainer is billed QUARTERLY-CADENCE.\nThe Manning retainer is billed MONTHLY-CADENCE under the project brief.","citations":["c01-contract","c01-brief"],"contradictions":["c01-brief","c01-contract"],"abstained":false},
  {"case_id":"contradiction-02","answer":"The current Lyra company registry lists headquarters city LISBON-HQ.\nThe Lyra partner deck lists headquarters city BERLIN-HQ.","citations":["c02-registry","c02-deck"],"contradictions":["c02-deck","c02-registry"],"abstained":false},
  {"case_id":"contradiction-03","answer":"The Nova catering sheet marks ALMOND-SAFE for Jordan.","citations":["c03-menu"],"contradictions":[],"abstained":false},
  {"case_id":"contradiction-04","answer":"The approved Atlas launch runbook shows start time 16:00-UTC on September 3.\nThe Atlas launch calendar shows start time 14:00-UTC on September 3.","citations":["c04-runbook","c04-calendar"],"contradictions":["c04-calendar","c04-runbook"],"abstained":false},
  {"case_id":"contradiction-05","answer":"For Cedar evening reviews, Rowan prefers COFFEE-EVENING.\nFor Cedar morning planning, Rowan prefers TEA-MORNING.","citations":["c05-evening","c05-morning"],"contradictions":[],"abstained":false},
  {"case_id":"six-month-01","answer":"The Halcyon audit binders are stored on shelf INDIGO-27 in the west archive.","citations":["m01-location"],"contradictions":[],"abstained":false},
  {"case_id":"six-month-02","answer":"The synthetic Orion locksmith recovery phrase for this benchmark is COPPER-WREN-61.","citations":["m02-phrase"],"contradictions":[],"abstained":false},
  {"case_id":"six-month-03","answer":"For Meridian weekly reviews, the closing ritual is THREE-BLUE-QUESTIONS.","citations":["m03-ritual"],"contradictions":[],"abstained":false},
  {"case_id":"six-month-04","answer":"The Vesper prototype enclosure material decision was BASALT-FIBER.","citations":["m04-material"],"contradictions":[],"abstained":false},
  {"case_id":"six-month-05","answer":"The Tamarack donation split is RIVER-60 for watershed work and TRAIL-40 for access work.","citations":["m05-split"],"contradictions":[],"abstained":false},
  {"case_id":"continuity-01","answer":"In the Quill planning session, we chose project alias SILVER-FINCH.","citations":["x01-alias"],"contradictions":[],"abstained":false},
  {"case_id":"continuity-02","answer":"For the Opal follow-up, DANA-OWNS-CONTRACT is the assigned owner marker.","citations":["x02-owner"],"contradictions":[],"abstained":false},
  {"case_id":"continuity-03","answer":"For Kestrel updates, the user prefers BULLETS-BEFORE-NARRATIVE.","citations":["x03-pref"],"contradictions":[],"abstained":false},
  {"case_id":"continuity-04","answer":"The unresolved Lumen decision is WHETHER-TO-SHARD-LEDGER.","citations":["x04-open"],"contradictions":[],"abstained":false},
  {"case_id":"continuity-05","answer":"The next Nimbus step after kickoff is TEST-FAILOVER-DRILL.","citations":["x05-step"],"contradictions":[],"abstained":false},
  {"case_id":"stale-01","answer":"Raven changed vendors; the current logistics vendor is BLUEHARBOR-NEW, replacing Northstar.","citations":["s01-new"],"contradictions":[],"abstained":false},
  {"case_id":"stale-02","answer":"The Pine review moved; its recurring day is THURSDAY-NEW.","citations":["s02-new"],"contradictions":[],"abstained":false},
  {"case_id":"stale-03","answer":"Casey corrected the Willow meal preference to VEGAN-NEW.","citations":["s03-new"],"contradictions":[],"abstained":false},
  {"case_id":"stale-04","answer":"Delta moved again; the current office address code is ELM-39-CURRENT.","citations":["s04-third"],"contradictions":[],"abstained":false},
  {"case_id":"stale-05","answer":"QA completed and corrected Zenith's release status to CLEARED-NEW.","citations":["s05-new"],"contradictions":[],"abstained":false}
]
